Name,Description,Icon_color,Lat,Long,URL,Thumb_URL南京的烧烤,南京是一个有着玄武湖和紫金山的城市。在南京工作的时候，客户对我们非常热情，邀请我们和他们的团队一起到玄武湖畔烧烤。,R,32.02911,118.787518,http://farm3.staticflickr.com/2421/4021921945_a1547e0383_b.jpg,http://farm3.staticflickr.com/2421/4021921945_a1547e0383_m.jpg广州的夜色,在广州的时候，天气非常热，我们每天吃完美食（有葡国菜、港式烧腊、湛江白切鸡⋯⋯好多好吃的），就买上一堆酒回到房间看世界杯，周末就一起去暨南大学打球。,R,23.126595,113.320247,http://farm4.staticflickr.com/3371/4618857352_e313b30c3d_b.jpg,http://farm4.staticflickr.com/3371/4618857352_e313b30c3d_m.jpg上海的有轨电车,张江是一个有着有轨电车的干净漂亮的小镇。在张江的日子，每天的生活就是开车上班，下班找吃的，然后开车回酒店。时间过得平静怡然。,R,31.198642,121.583102,http://farm4.staticflickr.com/3236/3802059119_95753c31a9_z.jpg,http://farm4.staticflickr.com/3236/3802059119_95753c31a9_m.jpg西安的妹子,马飞在歌里唱道：“长安县，妹子都不好看。”其实陕西的妹子还是很美的，有时会憨憨的咧嘴一笑，没有矫揉造作。,R,34.185742,108.884938,http://farm6.staticflickr.com/5066/5626825242_506f157bc5_b.jpg,http://farm6.staticflickr.com/5066/5626825242_506f157bc5_m.jpg成都的悠闲,老话说“少不入川”，成都是一个安逸的城市。受着这个城市的感染，即使在筹建成都办公室的时候，我们还是要忙里偷闲出去玩玩。,R,30.54339,104.068465,http://farm8.staticflickr.com/7012/6564247733_3ed8b06a7b_b.jpg,http://farm8.staticflickr.com/7012/6564247733_3ed8b06a7b_m.jpg塘沽的烤串,虽然客户的办公室主任请我们吃了很多山珍海味，可是在塘沽印象最深刻的，还是就着燕京啤酒的烤串。,R,39.026024,117.707645,http://farm2.staticflickr.com/1247/3169986852_3afb8238f3_o.jpg,http://farm2.staticflickr.com/1247/3169986852_29088d63dd_m.jpg